{
  "api": "arsenal.piano.theory.window_session/v1",
  "id": "ws05-pedal-change",
  "about": "a pedal change at the chord change: the old chord stops ringing and the new bass starts a window",
  "key": "Eb major",
  "profile": {
    "gap_ms": [
      190,
      250,
      400
    ],
    "pedal_down_share": 0.93,
    "sources": [
      "midi"
    ]
  },
  "same_as": null,
  "tick_ms": [
    100,
    1000
  ],
  "expect": {
    "tolerance_ms": 50,
    "end_ms": 5100,
    "windows": [
      {
        "start_ms": 0,
        "cause": "first",
        "played": "Ebmaj9"
      },
      {
        "start_ms": 2500,
        "cause": "new bass",
        "played": "Abmaj7#11"
      }
    ]
  },
  "events": [
    {"t_ms":0,"kind":"on","note":39,"vel":58,"source":"midi"},
    {"t_ms":8,"kind":"on","note":50,"vel":65,"source":"midi"},
    {"t_ms":16,"kind":"on","note":55,"vel":59,"source":"midi"},
    {"t_ms":24,"kind":"on","note":65,"vel":66,"source":"midi"},
    {"t_ms":32,"kind":"on","note":70,"vel":60,"source":"midi"},
    {"t_ms":100,"kind":"pedal","down":true,"source":"midi"},
    {"t_ms":400,"kind":"off","note":39,"source":"midi"},
    {"t_ms":408,"kind":"off","note":50,"source":"midi"},
    {"t_ms":416,"kind":"off","note":55,"source":"midi"},
    {"t_ms":424,"kind":"off","note":65,"source":"midi"},
    {"t_ms":432,"kind":"off","note":70,"source":"midi"},
    {"t_ms":2450,"kind":"pedal","down":false,"source":"midi"},
    {"t_ms":2450,"kind":"sound_end","note":39,"by":"pedal","source":"midi"},
    {"t_ms":2450,"kind":"sound_end","note":50,"by":"pedal","source":"midi"},
    {"t_ms":2450,"kind":"sound_end","note":55,"by":"pedal","source":"midi"},
    {"t_ms":2450,"kind":"sound_end","note":65,"by":"pedal","source":"midi"},
    {"t_ms":2450,"kind":"sound_end","note":70,"by":"pedal","source":"midi"},
    {"t_ms":2500,"kind":"on","note":44,"vel":58,"source":"midi"},
    {"t_ms":2508,"kind":"on","note":55,"vel":65,"source":"midi"},
    {"t_ms":2516,"kind":"on","note":60,"vel":59,"source":"midi"},
    {"t_ms":2524,"kind":"on","note":74,"vel":66,"source":"midi"},
    {"t_ms":2532,"kind":"on","note":75,"vel":60,"source":"midi"},
    {"t_ms":2600,"kind":"pedal","down":true,"source":"midi"},
    {"t_ms":2900,"kind":"off","note":44,"source":"midi"},
    {"t_ms":2908,"kind":"off","note":55,"source":"midi"},
    {"t_ms":2916,"kind":"off","note":60,"source":"midi"},
    {"t_ms":2924,"kind":"off","note":74,"source":"midi"},
    {"t_ms":2932,"kind":"off","note":75,"source":"midi"},
    {"t_ms":5000,"kind":"pedal","down":false,"source":"midi"},
    {"t_ms":5000,"kind":"sound_end","note":44,"by":"pedal","source":"midi"},
    {"t_ms":5000,"kind":"sound_end","note":55,"by":"pedal","source":"midi"},
    {"t_ms":5000,"kind":"sound_end","note":60,"by":"pedal","source":"midi"},
    {"t_ms":5000,"kind":"sound_end","note":74,"by":"pedal","source":"midi"},
    {"t_ms":5000,"kind":"sound_end","note":75,"by":"pedal","source":"midi"}
  ]
}
