{
  "api": "arsenal.piano.theory.window_session/v1",
  "id": "ws12-short-gap-no-split",
  "about": "the same chord again after under 0.6 s of silence (notes count as heard for 700 ms): one window",
  "key": "Db major",
  "profile": {
    "gap_ms": [
      190,
      250,
      400
    ],
    "pedal_down_share": 0,
    "sources": [
      "midi"
    ]
  },
  "same_as": null,
  "tick_ms": [
    100,
    1000
  ],
  "expect": {
    "tolerance_ms": 50,
    "end_ms": 2400,
    "windows": [
      {
        "start_ms": 0,
        "cause": "first",
        "played": "Bbm9"
      }
    ]
  },
  "events": [
    {"t_ms":0,"kind":"on","note":46,"vel":58,"source":"midi"},
    {"t_ms":6,"kind":"on","note":56,"vel":65,"source":"midi"},
    {"t_ms":12,"kind":"on","note":60,"vel":59,"source":"midi"},
    {"t_ms":18,"kind":"on","note":61,"vel":66,"source":"midi"},
    {"t_ms":24,"kind":"on","note":65,"vel":60,"source":"midi"},
    {"t_ms":500,"kind":"off","note":46,"source":"midi"},
    {"t_ms":500,"kind":"sound_end","note":46,"by":"release","source":"midi"},
    {"t_ms":506,"kind":"off","note":56,"source":"midi"},
    {"t_ms":506,"kind":"sound_end","note":56,"by":"release","source":"midi"},
    {"t_ms":512,"kind":"off","note":60,"source":"midi"},
    {"t_ms":512,"kind":"sound_end","note":60,"by":"release","source":"midi"},
    {"t_ms":518,"kind":"off","note":61,"source":"midi"},
    {"t_ms":518,"kind":"sound_end","note":61,"by":"release","source":"midi"},
    {"t_ms":524,"kind":"off","note":65,"source":"midi"},
    {"t_ms":524,"kind":"sound_end","note":65,"by":"release","source":"midi"},
    {"t_ms":1300,"kind":"on","note":46,"vel":58,"source":"midi"},
    {"t_ms":1306,"kind":"on","note":56,"vel":65,"source":"midi"},
    {"t_ms":1312,"kind":"on","note":60,"vel":59,"source":"midi"},
    {"t_ms":1318,"kind":"on","note":61,"vel":66,"source":"midi"},
    {"t_ms":1324,"kind":"on","note":65,"vel":60,"source":"midi"},
    {"t_ms":2300,"kind":"off","note":46,"source":"midi"},
    {"t_ms":2300,"kind":"sound_end","note":46,"by":"release","source":"midi"},
    {"t_ms":2306,"kind":"off","note":56,"source":"midi"},
    {"t_ms":2306,"kind":"sound_end","note":56,"by":"release","source":"midi"},
    {"t_ms":2312,"kind":"off","note":60,"source":"midi"},
    {"t_ms":2312,"kind":"sound_end","note":60,"by":"release","source":"midi"},
    {"t_ms":2318,"kind":"off","note":61,"source":"midi"},
    {"t_ms":2318,"kind":"sound_end","note":61,"by":"release","source":"midi"},
    {"t_ms":2324,"kind":"off","note":65,"source":"midi"},
    {"t_ms":2324,"kind":"sound_end","note":65,"by":"release","source":"midi"}
  ]
}
